Create a field hospital with the field

postgres=# CREATE TABLE hospital (doctorid varchar(10), doctorname varchar(20),department varchar(20),qualification varchar(20),experience int));
CREATE TABLE


postgres=# INSERT INTO hospital VALUES (1,'Vinod','Neurology','MD',3);
INSERT 0 1
postgres=# INSERT INTO hospital VALUES ('D003','Vinod','Skin','MD',7);
INSERT 0 1
postgres=# INSERT INTO hospital VALUES ('D006','Anoop','Skin','MBBS',7);
INSERT 0 1
postgres=# INSERT INTO hospital VALUES ('D005','Anu','General','MBBS',4);
INSERT 0 1
postgres=# INSERT INTO hospital VALUES ('D008','Manohar','General','MBBS',3);
INSERT 0 1
postgres=# select * from hospital;
 doctorid | doctorname | department | qualification | experience
----------+------------+------------+---------------+------------
 1        | Vinod      | Neurology  | MD            |          3
 D003     | Vinod      | Skin       | MD            |          7
 D006     | Anoop      | Skin       | MBBS          |          7
 D005     | Anu        | General    | MBBS          |          4
 D008     | Manohar    | General    | MBBS          |          3
(5 rows)



postgres=# SELECT * from hospital where qualification='MD';
 doctorid | doctorname | department | qualification | experience
----------+------------+------------+---------------+------------
 1        | Vinod      | Neurology  | MD            |          3
 D003     | Vinod      | Skin       | MD            |          7
(2 rows)

postgres=# SELECT * from hospital where qualification!='MD' AND experience>5;
 doctorid | doctorname | department | qualification | experience
----------+------------+------------+---------------+------------
 D006     | Anoop      | Skin       | MBBS          |          7
(1 row)


postgres=# SELECT * from hospital where department='Skin';
 doctorid | doctorname | department | qualification | experience
----------+------------+------------+---------------+------------
 D003     | Vinod      | Skin       | MD            |          7
 D006     | Anoop      | Skin       | MBBS          |          7
(2 rows)


postgres=# UPDATE hospital SET experience=5 where doctorid='D003';
UPDATE 1


postgres=# SELECT * from hospital;
 doctorid | doctorname | department | qualification | experience
----------+------------+------------+---------------+------------
 1        | Vinod      | Neurology  | MD            |          3
 D006     | Anoop      | Skin       | MBBS          |          7
 D005     | Anu        | General    | MBBS          |          4
 D008     | Manohar    | General    | MBBS          |          3
 D003     | Vinod      | Skin       | MD            |          5
(5 rows)

postgres=# DELETE FROM hospital where doctorid='D003';
DELETE 1
postgres=# SELECT * from hospital;
 doctorid | doctorname | department | qualification | experience
----------+------------+------------+---------------+------------
 1        | Vinod      | Neurology  | MD            |          3
 D006     | Anoop      | Skin       | MBBS          |          7
 D005     | Anu        | General    | MBBS          |          4
 D008     | Manohar    | General    | MBBS          |          3
(4 rows)
